{
  "schema_version": 1,
  "contract": "assumption-register-v1",
  "updated": "2026-10-24",
  "entries": [
    {
      "id": "foreign:hacl_sha256",
      "kind": "foreign-contract",
      "title": "HACL* SHA-256 linkage contract (WASM verified core)",
      "status": "specified-not-attested",
      "statement": "The extern hacl_sha256 writes the SHA-256 digest of input[0..input_len) into output and modifies nothing else; provided by Hacl_Hash_SHA2 through c/verified-core/hacl_bridge.c. The F* declaration is a linkage contract, not a proof of the C implementation or of the bridge.",
      "premise_ids": [
        "premise:VerifiedCore.Crypto.Hacl#hacl_sha256"
      ],
      "statements": {
        "premise:VerifiedCore.Crypto.Hacl#hacl_sha256": "c41832a27c072573c7aa97ab901af9b1983ed225ed7761d2bbe79c75fc4cdd26"
      },
      "references": [
        "docs/verification/claims/assumptions/current-register.md"
      ]
    },
    {
      "id": "foreign:hacl_ed25519_verify",
      "kind": "foreign-contract",
      "title": "HACL* Ed25519 verification linkage contract (WASM verified core)",
      "status": "specified-not-attested",
      "statement": "The extern hacl_ed25519_verify returns the HACL* Ed25519 verification result for (pk, msg[0..msg_len), sig) and leaves the heap unchanged; provided by Hacl_Ed25519 through the C bridge.",
      "premise_ids": [
        "premise:VerifiedCore.Crypto.Hacl#hacl_ed25519_verify"
      ],
      "statements": {
        "premise:VerifiedCore.Crypto.Hacl#hacl_ed25519_verify": "d9098cc2c6209a1ddd96b08dae178455594f226f76cd8b194921f29ef878dfb1"
      },
      "references": [
        "docs/verification/claims/assumptions/current-register.md"
      ]
    },
    {
      "id": "foreign:host_replay_store_check_and_store",
      "kind": "foreign-contract",
      "title": "WASM host replay-store atomic check-and-store contract",
      "status": "specified-not-attested",
      "statement": "The host callback performs an atomic check-and-store keyed by (namespace, key hash) with the given TTL and does not modify the F* heap. Atomicity and durability are host obligations.",
      "premise_ids": [
        "premise:VerifiedCore.Api.Claims.Runtime#host_replay_store_check_and_store"
      ],
      "statements": {
        "premise:VerifiedCore.Api.Claims.Runtime#host_replay_store_check_and_store": "fedec2d6b6126e45dfefba6c24341aff46d3d926501345cad00ebf0ca1dfc4d4"
      },
      "references": [
        "docs/verification/claims/assumptions/current-register.md"
      ]
    },
    {
      "id": "foreign:jose_header_entry_error_code",
      "kind": "foreign-contract",
      "title": "EverParse JOSE header entry validator linkage contract",
      "status": "specified-not-attested",
      "statement": "The extern returns the coarse EverParse validator error kind for one TLV entry buffer and leaves the heap unchanged; provided by c/jose_header_runtime.c over the generated validator.",
      "premise_ids": [
        "premise:Jose.HeaderParser.Runtime#jose_header_entry_error_code"
      ],
      "statements": {
        "premise:Jose.HeaderParser.Runtime#jose_header_entry_error_code": "5023b71c99c8dfa53ed3156aad7682750b791626026e6a1f63f93e3e48486e1c"
      },
      "references": [
        "docs/verification/claims/assumptions/current-register.md"
      ]
    },
    {
      "id": "foreign:bytes_prefix_of_buffer",
      "kind": "foreign-contract",
      "title": "OIDC hash runtime buffer-prefix copy contract",
      "status": "specified-not-attested",
      "statement": "bytes_prefix_of_buffer returns the first len bytes of a live buffer as an FStar.Bytes value; provided by c/hash_computation_runtime.c.",
      "premise_ids": [
        "premise:HashComputation.Low#bytes_prefix_of_buffer"
      ],
      "statements": {
        "premise:HashComputation.Low#bytes_prefix_of_buffer": "6ff13bfd8ee02cfbccdb9e536b81fcebe26c18b3d6721d2afc17d4fb31edab44"
      },
      "references": [
        "docs/verification/claims/assumptions/current-register.md"
      ],
      "expected_in_closure": false,
      "notes": "HashComputation.Low is not requested or imported by any production F* pass (Low* lane); the premise is registered for the runtime-linkage inventory only."
    },
    {
      "id": "foreign:evercrypt_hash_incremental_hash",
      "kind": "foreign-contract",
      "title": "OIDC hash runtime SHA-2 dispatch contract",
      "status": "specified-not-attested",
      "statement": "evercrypt_hash_incremental_hash requires a live output buffer of at least 32/48/64 bytes for SHA-256/384/512 and a matching input length; it preserves output liveness and frames modifications to that buffer. The provider is c/hash_computation_runtime.c backed by HACL*/EverCrypt. Functional digest correctness is not stated by this declaration and remains an external obligation.",
      "premise_ids": [
        "premise:HashComputation.Low#evercrypt_hash_incremental_hash"
      ],
      "statements": {
        "premise:HashComputation.Low#evercrypt_hash_incremental_hash": "464d7dcc278a5955f259367ccc7af642518328c1f1a522f0946e0065839f5086"
      },
      "references": [
        "docs/verification/claims/assumptions/current-register.md"
      ],
      "expected_in_closure": false,
      "notes": "HashComputation.Low is not requested or imported by any production F* pass (Low* lane); the premise is registered for the runtime-linkage inventory only."
    },
    {
      "id": "injected:C.Loops",
      "kind": "builder-injected",
      "title": "Builder-generated C.Loops loop combinators (assume val)",
      "status": "specified-not-attested",
      "statement": "scripts/flake/verify_fstar.sh writes fstar/C.Loops.fst with assume val while, do_while and total_while when no such file exists. The file shadows KaRaMeL's lib/krml/C.Loops.fst; the KaRaMeL checked artifact is reported stale and the EverParse modules that depend on C.Loops are re-loaded by lax-checking. The premises are the three declared loop contracts; the KaRaMeL implementations are not linked to them by any proof in this repository.",
      "premise_ids": [
        "premise:C.Loops#while",
        "premise:C.Loops#do_while",
        "premise:C.Loops#total_while"
      ],
      "statements": {
        "premise:C.Loops#while": "713423fef031ed2eaf333f1bc3654322d2720cdc2be3007cec90c81346e77c89",
        "premise:C.Loops#do_while": "03393a1e4586f43abb6616d59647ce02380a99057050053bb8d52fd333344e26",
        "premise:C.Loops#total_while": "145d196905274261b56b81dcdc16feeb75c6c166b091c9be5f8f8d13d3d3ba8e"
      },
      "notes": "Generator output digest 2fab471ce04ab4a3248ef183816ff0e46a48d006bcbe62ec0c0553a1ff035474 (fstar-2025.10.06 baseline)."
    },
    {
      "id": "friend:Verified.Crypto.Hmac.KeyEquiv>Spec.Agile.HMAC",
      "kind": "declaration",
      "title": "Implementation exposure of Spec.Agile.HMAC (friend)",
      "status": "specified-not-attested",
      "statement": "Verified.Crypto.Hmac.KeyEquiv opens the implementation of the HACL* Spec.Agile.HMAC module to prove the key block-normalisation equivalence. Its proofs depend on the lax-loaded HACL* implementation body, not only on the interface.",
      "premise_ids": [
        "premise:Verified.Crypto.Hmac.KeyEquiv#friend:Spec.Agile.HMAC"
      ],
      "statements": {
        "premise:Verified.Crypto.Hmac.KeyEquiv#friend:Spec.Agile.HMAC": "a9c0a994270cae6303ea98f1ebd92ddeaaff877733fa8937e8070f8d07004c48"
      }
    },
    {
      "id": "provider-lax-source:hacl",
      "kind": "provider-lax-source",
      "title": "HACL* specification modules are lax-checked from source",
      "status": "specified-not-attested",
      "statement": "HACL* sources with a positive lax-check event are loaded without re-verifying their lemmas in this invocation. The pinned package has no checked artifacts. Upstream verification of exactly these source bytes and the imported contracts remains an external acceptance obligation. Membership in the full dependency graph alone does not imply a type-checker load.",
      "covers": [
        {
          "kind": "lax-module",
          "origin": "provider:hacl"
        }
      ],
      "references": [
        "https://github.com/hacl-star/hacl-star"
      ]
    },
    {
      "id": "provider-lax-source:steel",
      "kind": "provider-lax-source",
      "title": "Steel sources are lax-checked from source",
      "status": "specified-not-attested",
      "statement": "Steel sources with a positive lax-check event are loaded without re-verifying their lemmas. The pinned source tree ships no checked artifacts; dependency-graph membership alone does not establish a load.",
      "covers": [
        {
          "kind": "lax-module",
          "origin": "provider:steel"
        }
      ]
    },
    {
      "id": "provider-lax-source:krml",
      "kind": "provider-lax-source",
      "title": "KaRaMeL library modules without a valid checked artifact are lax-checked",
      "status": "specified-not-attested",
      "statement": "KaRaMeL modules whose .checked artifact is absent or stale in the pinned package are lax-checked from source.",
      "covers": [
        {
          "kind": "lax-module",
          "origin": "provider:krml"
        }
      ]
    },
    {
      "id": "provider-lax-source:everparse",
      "kind": "provider-lax-source",
      "title": "EverParse modules without a usable checked artifact are lax-checked",
      "status": "specified-not-attested",
      "statement": "EverParse/LowParse modules whose .checked artifact is absent in the pinned package are lax-checked from source.",
      "covers": [
        {
          "kind": "lax-module",
          "origin": "provider:everparse",
          "stale": false
        }
      ]
    },
    {
      "id": "stale-cascade:C.Loops",
      "kind": "provider-lax-source",
      "title": "EverParse checked artifacts invalidated by the shadowed C.Loops",
      "status": "specified-not-attested",